<!ELEMENT videoclub (peliculas, ofertas)>
<!ELEMENT peliculas (pelicula)>
<!ELEMENT ofertas (oferta*)>
<!ELEMENT pelicula (nombre, genero, precio, (disponible | alquilada))>
<!ELEMENT nombre (#PCDATA)>
<!ELEMENT genero (#PCDATA)>
<!ELEMENT precio EMPTY>
<!ELEMENT disponible EMPTY>
<!ELEMENT alquilada EMPTY>
<!ELEMENT oferta (#PCDATA | platoReferido)*>
<!ELEMENT platoReferido ANY>
<!ATTLIST restaurante direccion CDATA #IMPLIED 
                      nombre CDATA #REQUIRED
                      telefono CDATA #FIXED "957591456">
<!ATTLIST pelicula codigo ID #REQUIRED
                ingredientePrincipal (queso | frijoles | chile) "queso">
<!ATTLIST peliculaReferida codigoPelicula IDREF #REQUIRED
                        bonoPareja IDREFS #IMPLIED>
<!ENTITY % atributoCoste "coste CDATA #IMPLIED"> 
<!ATTLIST precio %atributoCoste;>
<!ATTLIST oferta %atributoCoste;>
<!ENTITY picante "tres jalapeÃ±os">
