<?xml version="1.0" encoding="UTF-8"?>
<!DOCTYPE videoclub SYSTEM "Examen01.dtd">
<videoclub direccion="Calle La Patica" nombre="Sensacine" telefono="957405033">
  <peliculas>
    <pelicula codigo="her" ingredientePrincipal="queso">
      <nombre> Hércules </nombre>
      <genero> Fantasía </genero>
      <precio coste="10" />
      <alquilada/>
    </pelicula>
    <pelicula codigo="ins">
      <nombre> Insidious </nombre>
      <genero> Terror </genero>
      <precio coste="7" />
      <disponible/>
    </pelicula>
  </platos>
  <ofertas>
    <oferta coste="15">2x1 
      <peliculaReferida codigoPelicula="ques" bonoPareja="her ins" />
    </oferta>
  </ofertas>
  </peliculas>